{
  "schemaVersion": "autonomerce.transaction.public.v1",
  "recordKind": "transaction",
  "synthetic": false,
  "evidenceClassification": "testnet",
  "orderId": "order_4d14b7bcaedd089d80109a4b",
  "proposalId": "proposal_a71136f96f76825adaf23a2d",
  "paymentId": "payment_1b3e40ee6220e48585de30f4",
  "fulfillmentId": null,
  "network": "ARC-TESTNET",
  "token": "USDC",
  "amountUsdc": "0.1",
  "movesFunds": true,
  "transactionHash": "0xb3a036d46b71e93d37b69ddf1046ff1d708d1c4b33db73b863a4fa3d4a2f7d56",
  "explorerUrl": "https://testnet.arcscan.app/tx/0xb3a036d46b71e93d37b69ddf1046ff1d708d1c4b33db73b863a4fa3d4a2f7d56",
  "payerWallet": "0xd5eaf79637decd656e3adb52985cf0afb6cc29d8",
  "payeeWallet": "0xebbcd5a37a086cbe0e978c26feff14e69bffa2a6",
  "confirmedAt": "2026-07-31T17:04:42Z",
  "externalCustomer": false,
  "customerRelationship": "founder",
  "countedAsRevenue": false,
  "delivered": false,
  "acceptanceVerdict": "pending",
  "customerConsentToPublish": false,
  "consentRecordId": null,
  "artifactHash": null,
  "repositoryCommit": "1c0972b007d814b7e225a65d38dca87f659a5783",
  "deployedRevision": null,
  "evidenceGeneratedAt": "2026-07-31T17:09:23Z",
  "notes": [
    "Arc testnet integration proof using founder-owned Circle Agent Wallets; never customer revenue.",
    "Independent Arc JSON-RPC verification matched chain, canonical USDC contract, payer, payee, exact 0.10 amount, transaction hash, and successful receipt.",
    "Circle history showed one outbound transfer. Durable replay returned the same proposal, payment, and transaction identifiers without a second execution.",
    "Payer canonical ERC-20 USDC changed from 20.0 to 19.9 and payee changed from 0.0 to 0.1.",
    "This settlement-only proof is not an external sale, delivered order, deployed Gemini-to-Circle order, mainnet result, or production-readiness claim."
  ]
}
