{
  "schemaVersion": "autonomerce.transaction.public.v1",
  "recordKind": "transaction",
  "synthetic": true,
  "evidenceClassification": "synthetic",
  "orderId": "00000000-0000-4000-8000-000000000101",
  "proposalId": "proposal_6d96524837f214ca349400d6",
  "paymentId": "payment_9bba737255080a178d78b594",
  "fulfillmentId": "fulfillment_6816c00432019c6af6f121d1",
  "network": "ARC-TESTNET",
  "token": "USDC",
  "amountUsdc": "0.52",
  "movesFunds": false,
  "transactionHash": "0xc6cfbd09ec1bf29845b5a8d9d1f1a2dfd9724ff1128680553f3b1210e4a2473b",
  "explorerUrl": null,
  "payerWallet": null,
  "payeeWallet": null,
  "confirmedAt": "2000-01-01T00:00:00Z",
  "externalCustomer": false,
  "customerRelationship": "none_synthetic",
  "countedAsRevenue": false,
  "delivered": true,
  "acceptanceVerdict": "accepted",
  "customerConsentToPublish": false,
  "consentRecordId": null,
  "artifactHash": "sha256:dcf3f4af1b8d289e57d55234db096fb19a1fbbf59519d8694326a1158d3562b5",
  "repositoryCommit": "626bba7ff8a55c037ab0ffe183b7617b43907864",
  "deployedRevision": "autonomerce-api-00002-n8h",
  "evidenceGeneratedAt": "2026-07-31T15:32:52.202804Z",
  "notes": [
    "SYNTHETIC / OFFLINE PAYMENT RECORD.",
    "The deployed workflow used live Gemini productization but a mock payment adapter and deterministic offline fulfillment.",
    "The transaction hash is synthetic, has no explorer URL, and must not be counted as revenue.",
    "Replaying the same owner workflow operation returned the same proposal and payment IDs without a duplicate settlement."
  ]
}
