{
  "schemaVersion": "autonomerce.transaction.public.v1",
  "recordKind": "transaction",
  "synthetic": true,
  "evidenceClassification": "synthetic",
  "orderId": "synthetic_order_example_001",
  "proposalId": "proposal_000000000000000000000001",
  "paymentId": "payment_000000000000000000000001",
  "fulfillmentId": "fulfillment_000000000000000000000001",
  "network": "ARC-TESTNET",
  "token": "USDC",
  "amountUsdc": "0.1",
  "movesFunds": false,
  "transactionHash": "0x0000000000000000000000000000000000000000000000000000000000000001",
  "explorerUrl": null,
  "payerWallet": "0x1111111111111111111111111111111111111111",
  "payeeWallet": "0x2222222222222222222222222222222222222222",
  "confirmedAt": "2026-07-31T12:00:02Z",
  "externalCustomer": false,
  "customerRelationship": "none_synthetic",
  "countedAsRevenue": false,
  "delivered": true,
  "acceptanceVerdict": "accepted",
  "customerConsentToPublish": false,
  "consentRecordId": null,
  "artifactHash": "sha256:0000000000000000000000000000000000000000000000000000000000000001",
  "repositoryCommit": null,
  "deployedRevision": null,
  "evidenceGeneratedAt": "2026-07-31T12:00:04Z",
  "notes": [
    "SYNTHETIC SCHEMA EXAMPLE ONLY.",
    "No customer exists, no funds moved, and this amount must not be counted as revenue."
  ]
}
